"","field","required","type","description","table"
"318","cdm_source_name","Yes","VARCHAR(255)","The full name of the source","cdm_source"
"319","cdm_source_abbreviation","No","VARCHAR(25)","An abbreviation of the name","cdm_source"
"320","cdm_holder","No","VARCHAR(255)","The name of the organization responsible for the development of the CDM instance","cdm_source"
"321","source_description","No","CLOB","A description of the source data origin and purpose for collection. The description may contain a summary of the period of time that is expected to be covered by this dataset.","cdm_source"
"322","source_documentation_reference","No","VARCHAR(255)","URL or other external reference to location of source documentation","cdm_source"
"323","cdm_etl_reference","No","VARCHAR(255)","URL or other external reference to location of ETL specification documentation and ETL source code","cdm_source"
"324","source_release_date","No","DATE","The date for which the source data are most current, such as the last day of data capture","cdm_source"
"325","cdm_release_date","No","DATE","The date when the CDM was instantiated","cdm_source"
"326","cdm_version","No","VARCHAR(10)","The version of CDM used","cdm_source"
"327","vocabulary_version","No","VARCHAR(20)","The version of the vocabulary used","cdm_source"
"328","metadata_concept_id","Yes","INTEGER","A foreign key that refers to a Standard Metadata Concept identifier in the Standardized Vocabularies.","metadata"
"329","metadata_type_concept_id","Yes","INTEGER","A foreign key that refers to a Standard Type Concept identifier in the Standardized Vocabularies.","metadata"
"330","name","Yes","VARCHAR(250)","The name of the Concept stored in metadata_concept_id or a description of the data being stored.","metadata"
"331","value_as_string","No","NVARCHAR","The metadata value stored as a string.","metadata"
"332","value_as_concept_id","No","INTEGER","A foreign key to a metadata value stored as a Concept ID.","metadata"
"333","metadata date","No","DATE","The date associated with the metadata","metadata"
"334","metadata_datetime","No","DATETIME","The date and time associated with the metadata","metadata"
"335","attribute_definition_id","Yes","INTEGER","A unique identifier for each Attribute.","attribute_definition"
"336","attribute_name","Yes","VARCHAR(255)","A short description of the Attribute.","attribute_definition"
"337","attribute_description","No","VARCHAR(MAX)","A complete description of the Attribute definition","attribute_definition"
"338","attribute_type_concept_id","Yes","INTEGER","Type defining what kind of Attribute Definition the record represents and how the syntax may be executed","attribute_definition"
"339","attribute_syntax","No","VARCHAR(MAX)","Syntax or code to operationalize the Attribute definition","attribute_definition"
"340","cohort_definition_id","Yes","INTEGER","A unique identifier for each Cohort.","cohort_definition"
"341","cohort_definition_name","Yes","VARCHAR(255)","A short description of the Cohort.","cohort_definition"
"342","cohort_definition_description","No","VARCHAR(MAX)","A complete description of the Cohort definition","cohort_definition"
"343","definition_type_concept_id","Yes","INTEGER","Type defining what kind of Cohort Definition the record represents and how the syntax may be executed","cohort_definition"
"344","cohort_definition_syntax","No","VARCHAR(MAX)","Syntax or code to operationalize the Cohort definition","cohort_definition"
"345","subject_concept_id","Yes","INTEGER","A foreign key to the Concept to which defines the domain of subjects that are members of the cohort (e.g., Person, Provider, Visit).","cohort_definition"
"346","cohort_initiation_date","No","DATE","A date to indicate when the Cohort was initiated in the COHORT table","cohort_definition"
"347","concept_id","Yes","INTEGER","A unique identifier for each Concept across all domains.","concept"
"348","concept_name","Yes","VARCHAR(255)","An unambiguous, meaningful and descriptive name for the Concept.","concept"
"349","domain_id","Yes","VARCHAR(20)","A foreign key to the [DOMAIN](https://github.com/OHDSI/CommonDataModel/wiki/DOMAIN) table the Concept belongs to.","concept"
"350","vocabulary_id","Yes","VARCHAR(20)","A foreign key to the [VOCABULARY](https://github.com/OHDSI/CommonDataModel/wiki/VOCABULARY) table indicating from which source the Concept has been adapted.","concept"
"351","concept_class_id","Yes","VARCHAR(20)","The attribute or concept class of the Concept. Examples are 'Clinical Drug', 'Ingredient', 'Clinical Finding' etc.","concept"
"352","standard_concept","No","VARCHAR(1)","This flag determines where a Concept is a Standard Concept, i.e. is used in the data, a Classification Concept, or a non-standard Source Concept. The allowables values are 'S' (Standard Concept) and 'C' (Classification Concept), otherwise the content is NULL.","concept"
"353","concept_code","Yes","VARCHAR(50)","The concept code represents the identifier of the Concept in the source vocabulary, such as SNOMED-CT concept IDs, RxNorm RXCUIs etc. Note that concept codes are not unique across vocabularies.","concept"
"354","valid_start_date","Yes","DATE","The date when the Concept was first recorded. The default value is 1-Jan-1970, meaning, the Concept has no (known) date of inception.","concept"
"355","valid_end_date","Yes","DATE","The date when the Concept became invalid because it was deleted or superseded (updated) by a new concept. The default value is 31-Dec-2099, meaning, the Concept is valid until it becomes deprecated.","concept"
"356","invalid_reason","No","VARCHAR(1)","Reason the Concept was invalidated. Possible values are D (deleted), U (replaced with an update) or NULL when valid_end_date has the default value.","concept"
"357","ancestor_concept_id","Yes","INTEGER","A foreign key to the concept in the concept table for the higher-level concept that forms the ancestor in the relationship.","concept_ancestor"
"358","descendant_concept_id","Yes","INTEGER","A foreign key to the concept in the concept table for the lower-level concept that forms the descendant in the relationship.","concept_ancestor"
"359","min_levels_of_separation","Yes","INTEGER","The minimum separation in number of levels of hierarchy between ancestor and descendant concepts. This is an attribute that is used to simplify hierarchic analysis.","concept_ancestor"
"360","max_levels_of_separation","Yes","INTEGER","The maximum separation in number of levels of hierarchy between ancestor and descendant concepts. This is an attribute that is used to simplify hierarchic analysis.","concept_ancestor"
"361","concept_class_id","Yes","VARCHAR(20)","A unique key for each class.","concept_class"
"362","concept_class_name","Yes","VARCHAR(255)","The name describing the Concept Class, e.g. ""Clinical Finding"", ""Ingredient"", etc.","concept_class"
"363","concept_class_concept_id","Yes","INTEGER","A foreign key that refers to an identifier in the [CONCEPT](https://github.com/OHDSI/CommonDataModel/wiki/CONCEPT) table for the unique Concept Class the record belongs to.","concept_class"
"364","concept_id_1","Yes","INTEGER","A foreign key to a Concept in the [CONCEPT](https://github.com/OHDSI/CommonDataModel/wiki/CONCEPT) table associated with the relationship. Relationships are directional, and this field represents the source concept designation.","concept_relationship"
"365","concept_id_2","Yes","INTEGER","A foreign key to a Concept in the [CONCEPT](https://github.com/OHDSI/CommonDataModel/wiki/CONCEPT) table associated with the relationship. Relationships are directional, and this field represents the destination concept designation.","concept_relationship"
"366","relationship_id","Yes","VARCHAR(20)","A unique identifier to the type or nature of the Relationship as defined in the [RELATIONSHIP](https://github.com/OHDSI/CommonDataModel/wiki/RELATIONSHIP) table.","concept_relationship"
"367","valid_start_date","Yes","DATE","The date when the instance of the Concept Relationship is first recorded.","concept_relationship"
"368","valid_end_date","Yes","DATE","The date when the Concept Relationship became invalid because it was deleted or superseded (updated) by a new relationship. Default value is 31-Dec-2099.","concept_relationship"
"369","invalid_reason","No","VARCHAR(1)","Reason the relationship was invalidated. Possible values are 'D' (deleted), 'U' (replaced with an update) or NULL when valid_end_date has the default value.","concept_relationship"
"370","concept_id","Yes","INTEGER","A foreign key to the Concept in the CONCEPT table.","concept_synonym"
"371","concept_synonym_name","Yes","VARCHAR(1000)","The alternative name for the Concept.","concept_synonym"
"372","language_concept_id","Yes","INTEGER","A foreign key to a Concept representing the language.","concept_synonym"
"373","domain_id","Yes","VARCHAR(20)","A unique key for each domain.","domain"
"374","domain_name","Yes","VARCHAR(255)","The name describing the Domain, e.g. ""Condition"", ""Procedure"", ""Measurement"" etc.","domain"
"375","domain_concept_id","Yes","INTEGER","A foreign key that refers to an identifier in the [CONCEPT](https://github.com/OHDSI/CommonDataModel/wiki/CONCEPT) table for the unique Domain Concept the Domain record belongs to.","domain"
"376","drug_concept_id","Yes","INTEGER","A foreign key to the Concept in the CONCEPT table representing the identifier for Branded Drug or Clinical Drug Concept.","drug_strength"
"377","ingredient_concept_id","Yes","INTEGER","A foreign key to the Concept in the CONCEPT table, representing the identifier for drug Ingredient Concept contained within the drug product.","drug_strength"
"378","amount_value","No","FLOAT","The numeric value associated with the amount of active ingredient contained within the product.","drug_strength"
"379","amount_unit_concept_id","No","INTEGER","A foreign key to the Concept in the CONCEPT table representing the identifier for the Unit for the absolute amount of active ingredient.","drug_strength"
"380","numerator_value","No","FLOAT","The numeric value associated with the concentration of the active ingredient contained in the product","drug_strength"
"381","numerator_unit_concept_id","No","INTEGER","A foreign key to the Concept in the CONCEPT table representing the identifier for the numerator Unit for the concentration of active ingredient.","drug_strength"
"382","denominator_value","No","FLOAT","The amount of total liquid (or other divisible product, such as ointment, gel, spray, etc.).","drug_strength"
"383","denominator_unit_concept_id","No","INTEGER","A foreign key to the Concept in the CONCEPT table representing the identifier for the denominator Unit for the concentration of active ingredient.","drug_strength"
"384","box_size","No","INTEGER","The number of units of Clinical of Branded Drug, or Quantified Clinical or Branded Drug contained in a box as dispensed to the patient","drug_strength"
"385","valid_start_date","Yes","DATE","The date when the Concept was first recorded. The default value is 1-Jan-1970.","drug_strength"
"386","valid_end_date","Yes","DATE","The date when the concept became invalid because it was deleted or superseded (updated) by a new Concept. The default value is 31-Dec-2099.","drug_strength"
"387","invalid_reason","No","VARCHAR(1)","Reason the concept was invalidated. Possible values are 'D' (deleted), 'U' (replaced with an update) or NULL when valid_end_date has the default value.","drug_strength"
"388","relationship_id","Yes","VARCHAR(20)","The type of relationship captured by the relationship record.","relationship"
"389","relationship_name","Yes","VARCHAR(255)","The text that describes the relationship type.","relationship"
"390","is_hierarchical","Yes","VARCHAR(1)","Defines whether a relationship defines concepts into classes or hierarchies. Values are 1 for hierarchical relationship or 0 if not.","relationship"
"391","defines_ancestry","Yes","VARCHAR(1)","Defines whether a hierarchical relationship contributes to the concept_ancestor table. These are subsets of the hierarchical relationships. Valid values are 1 or 0.","relationship"
"392","reverse_relationship_id","Yes","VARCHAR(20)","The identifier for the relationship used to define the reverse relationship between two concepts.","relationship"
"393","relationship_concept_id","Yes","INTEGER","A foreign key that refers to an identifier in the CONCEPT table for the unique relationship concept.","relationship"
"394","source_code","Yes","VARCHAR(50)","The source code being translated into a Standard Concept.","source_to_concept_map"
"395","source_concept_id","Yes","INTEGER","A foreign key to the Source Concept that is being translated into a Standard Concept.","source_to_concept_map"
"396","source_vocabulary_id","Yes","VARCHAR(20)","A foreign key to the VOCABULARY table defining the vocabulary of the source code that is being translated to a Standard Concept.","source_to_concept_map"
"397","source_code_description","No","VARCHAR(255)","An optional description for the source code. This is included as a convenience to compare the description of the source code to the name of the concept.","source_to_concept_map"
"398","target_concept_id","Yes","INTEGER","A foreign key to the target Concept to which the source code is being mapped.","source_to_concept_map"
"399","target_vocabulary_id","Yes","VARCHAR(20)","A foreign key to the VOCABULARY table defining the vocabulary of the target Concept.","source_to_concept_map"
"400","valid_start_date","Yes","DATE","The date when the mapping instance was first recorded.","source_to_concept_map"
"401","valid_end_date","Yes","DATE","The date when the mapping instance became invalid because it was deleted or superseded (updated) by a new relationship. Default value is 31-Dec-2099.","source_to_concept_map"
"402","invalid_reason","No","VARCHAR(1)","Reason the mapping instance was invalidated. Possible values are D (deleted), U (replaced with an update) or NULL when valid_end_date has the default value.","source_to_concept_map"
"403","vocabulary_id","Yes","VARCHAR(20)","A unique identifier for each Vocabulary, such as ICD9CM, SNOMED, Visit.","vocabulary"
"404","vocabulary_name","Yes","VARCHAR(255)","The name describing the vocabulary, for example ""International Classification of Diseases, Ninth Revision, Clinical Modification, Volume 1 and 2 (NCHS)"" etc.","vocabulary"
"405","vocabulary_reference","Yes","VARCHAR(255)","External reference to documentation or available download of the about the vocabulary.","vocabulary"
"406","vocabulary_version","No","VARCHAR(255)","Version of the Vocabulary as indicated in the source.","vocabulary"
"407","vocabulary_concept_id","Yes","INTEGER","A foreign key that refers to a standard concept identifier in the CONCEPT table for the Vocabulary the VOCABULARY record belongs to.","vocabulary"
