"","field","required","type","description","table"
"154","ethnicity_source_value","No","VARCHAR(50)","The source code for the ethnicity of the person as it appears in the source data. The person ethnicity is mapped to a standard ethnicity concept in the Standardized Vocabularies and the original code is, stored here for reference.","person"
"155","ethnicity_source_concept_id","No","INTEGER","A foreign key to the ethnicity concept that refers to the code used in the source.","person"
"156","procedure_occurrence_id","Yes","INTEGER","A system-generated unique identifier for each Procedure Occurrence.","procedure_occurrence"
"157","person_id","Yes","INTEGER","A foreign key identifier to the Person who is subjected to the Procedure. The demographic details of that Person are stored in the PERSON table.","procedure_occurrence"
"158","procedure_concept_id","Yes","INTEGER","A foreign key that refers to a standard procedure Concept identifier in the Standardized Vocabularies.","procedure_occurrence"
"159","procedure_date","Yes","DATE","The date on which the Procedure was performed.","procedure_occurrence"
"160","procedure_datetime","No","DATETIME","The date and time on which the Procedure was performed.","procedure_occurrence"
"161","procedure_type_concept_id","Yes","INTEGER","A foreign key to the predefined Concept identifier in the Standardized Vocabularies reflecting the type of source data from which the procedure record is derived.","procedure_occurrence"
"162","modifier_concept_id","No","INTEGER","A foreign key to a Standard Concept identifier for a modifier to the Procedure (e.g. bilateral)","procedure_occurrence"
"163","quantity","No","INTEGER","The quantity of procedures ordered or administered.","procedure_occurrence"
"164","provider_id","No","INTEGER","A foreign key to the provider in the PROVIDER table who was responsible for carrying out the procedure.","procedure_occurrence"
"165","visit_occurrence_id","No","INTEGER","A foreign key to the Visit in the VISIT_OCCURRENCE table during which the Procedure was carried out.","procedure_occurrence"
"166","visit_detail_id","No","INTEGER","A foreign key to the Visit Detail in the VISIT_DETAIL table during which the Procedure was carried out.","procedure_occurrence"
"167","procedure_source_value","No","VARCHAR(50)","The source code for the Procedure as it appears in the source data. This code is mapped to a standard procedure Concept in the Standardized Vocabularies and the original code is, stored here for reference. Procedure source codes are typically ICD-9-Proc, CPT-4, HCPCS or OPCS-4 codes.","procedure_occurrence"
"168","procedure_source_concept_id","No","INTEGER","A foreign key to a Procedure Concept that refers to the code used in the source.","procedure_occurrence"
"169","modifier_source_value","No","VARCHAR(50)","The source code for the qualifier as it appears in the source data.","procedure_occurrence"
"170","specimen_id","Yes","INTEGER","A unique identifier for each specimen.","specimen"
"171","person_id","Yes","INTEGER","A foreign key identifier to the Person for whom the Specimen is recorded.","specimen"
"172","specimen_concept_id","Yes","INTEGER","A foreign key referring to a Standard Concept identifier in the Standardized Vocabularies for the Specimen.","specimen"
"173","specimen_type_concept_id","Yes","INTEGER","A foreign key referring to the Concept identifier in the Standardized Vocabularies reflecting the system of record from which the Specimen was represented in the source data.","specimen"
"174","specimen_date","Yes","DATE","The date the specimen was obtained from the Person.","specimen"
"175","specimen_datetime","No","DATETIME","The date and time on the date when the Specimen was obtained from the person.","specimen"
"176","quantity","No","FLOAT","The amount of specimen collection from the person during the sampling procedure.","specimen"
"177","unit_concept_id","No","INTEGER","A foreign key to a Standard Concept identifier for the Unit associated with the numeric quantity of the Specimen collection.","specimen"
"178","anatomic_site_concept_id","No","INTEGER","A foreign key to a Standard Concept identifier for the anatomic location of specimen collection.","specimen"
"179","disease_status_concept_id","No","INTEGER","A foreign key to a Standard Concept identifier for the Disease Status of specimen collection.","specimen"
"180","specimen_source_id","No","VARCHAR(50)","The Specimen identifier as it appears in the source data.","specimen"
"181","specimen_source_value","No","VARCHAR(50)","The Specimen value as it appears in the source data. This value is mapped to a Standard Concept in the Standardized Vocabularies and the original code is, stored here for reference.","specimen"
"182","unit_source_value","No","VARCHAR(50)","The information about the Unit as detailed in the source.","specimen"
"183","anatomic_site_source_value","No","VARCHAR(50)","The information about the anatomic site as detailed in the source.","specimen"
"184","disease_status_source_value","No","VARCHAR(50)","The information about the disease status as detailed in the source.","specimen"
"185","visit_detail_id","Yes","INTEGER","A unique identifier for each Person's visit or encounter at a healthcare provider.","visit_detail"
"186","person_id","Yes","INTEGER","A foreign key identifier to the Person for whom the visit is recorded. The demographic details of that Person are stored in the PERSON table.","visit_detail"
"187","visit_concept_id","Yes","INTEGER","A foreign key that refers to a visit Concept identifier in the Standardized Vocabularies.","visit_detail"
"188","visit_start_date","Yes","DATE","The start date of the visit.","visit_detail"
"189","visit_start_datetime","No","DATETIME","The date and time of the visit started.","visit_detail"
"190","visit_end_date","Yes","DATE","The end date of the visit. If this is a one-day visit the end date should match the start date.","visit_detail"
"191","visit_end_datetime","No","DATETIME","The date and time of the visit end.","visit_detail"
"192","visit_type_concept_id","Yes","INTEGER","A foreign key to the predefined Concept identifier in the Standardized Vocabularies reflecting the type of source data from which the visit record is derived.","visit_detail"
"193","provider_id","No","INTEGER","A foreign key to the provider in the provider table who was associated with the visit.","visit_detail"
"194","care_site_id","No","INTEGER","A foreign key to the care site in the care site table that was visited.","visit_detail"
"195","visit_source_value","No","STRING(50)","The source code for the visit as it appears in the source data.","visit_detail"
"196","visit_source_concept_id","No","INTEGER","A foreign key to a Concept that refers to the code used in the source.","visit_detail"
"197","admitting_source_value","No","VARCHAR(50)","The source code for the admitting source as it appears in the source data.","visit_detail"
"198","admitting_source_concept_id","No","INTEGER","A foreign key to the predefined concept in the Place of Service Vocabulary reflecting the admitting source for a visit.","visit_detail"
"199","discharge_to_source_value","No","VARCHAR(50)","The source code for the discharge disposition as it appears in the source data.","visit_detail"
"200","discharge_to_concept_id","No","INTEGER","A foreign key to the predefined concept in the Place of Service Vocabulary reflecting the discharge disposition for a visit.","visit_detail"
"201","preceding_visit_detail_id","No","INTEGER","A foreign key to the VISIT_DETAIL table of the visit immediately preceding this visit","visit_detail"
"202","visit_detail_parent_id","No","INTEGER","A foreign key to the VISIT_DETAIL table record to represent the immediate parent visit-detail record.","visit_detail"
"203","visit_occurrence_id","Yes","INTEGER","A foreign key that refers to the record in the VISIT_OCCURRENCE table. This is a required field, because for every visit_detail is a child of visit_occurrence and cannot exist without a corresponding parent record in visit_occurrence.","visit_detail"
"204","visit_occurrence_id","Yes","INTEGER","A unique identifier for each Person's visit or encounter at a healthcare provider.","visit_occurrence"
"205","person_id","Yes","INTEGER","A foreign key identifier to the Person for whom the visit is recorded. The demographic details of that Person are stored in the PERSON table.","visit_occurrence"
"206","visit_concept_id","Yes","INTEGER","A foreign key that refers to a visit Concept identifier in the Standardized Vocabularies.","visit_occurrence"
"207","visit_start_date","Yes","DATE","The start date of the visit.","visit_occurrence"
"208","visit_start_datetime","No","DATETIME","The date and time of the visit started.","visit_occurrence"
"209","visit_end_date","Yes","DATE","The end date of the visit. If this is a one-day visit the end date should match the start date.","visit_occurrence"
"210","visit_end_datetime","No","DATETIME","The date and time of the visit end.","visit_occurrence"
"211","visit_type_concept_id","Yes","INTEGER","A foreign key to the predefined Concept identifier in the Standardized Vocabularies reflecting the type of source data from which the visit record is derived.","visit_occurrence"
"212","provider_id","No","INTEGER","A foreign key to the provider in the provider table who was associated with the visit.","visit_occurrence"
"213","care_site_id","No","INTEGER","A foreign key to the care site in the care site table that was visited.","visit_occurrence"
"214","visit_source_value","No","VARCHAR(50)","The source code for the visit as it appears in the source data.","visit_occurrence"
"215","visit_source_concept_id","No","INTEGER","A foreign key to a Concept that refers to the code used in the source.","visit_occurrence"
"216","admitting_source_concept_id","No","INTEGER","A foreign key to the predefined concept in the Place of Service Vocabulary reflecting the admitting source for a visit.","visit_occurrence"
"217","admitting_source_value","No","VARCHAR(50)","The source code for the admitting source as it appears in the source data.","visit_occurrence"
"218","discharge_to_concept_id","No","INTEGER","A foreign key to the predefined concept in the Place of Service Vocabulary reflecting the discharge disposition for a visit.","visit_occurrence"
"219","discharge_to_source_value","No","VARCHAR(50)","The source code for the discharge disposition as it appears in the source data.","visit_occurrence"
"220","preceding_visit_occurrence_id","No","INTEGER","A foreign key to the VISIT_OCCURRENCE table of the visit immediately preceding this visit","visit_occurrence"
"221","cohort_definition_id","Yes","INTEGER","A foreign key to a record in the COHORT_DEFINITION table containing relevant Cohort Definition information.","cohort"
"222","subject_id","Yes","INTEGER","A foreign key to the subject in the cohort. These could be referring to records in the PERSON, PROVIDER, VISIT_OCCURRENCE table.","cohort"
"223","cohort_start_date","Yes","DATE","The date when the Cohort Definition criteria for the Person, Provider or Visit first match.","cohort"
"224","cohort_end_date","Yes","DATE","The date when the Cohort Definition criteria for the Person, Provider or Visit no longer match or the Cohort membership was terminated.","cohort"
"225","cohort_definition_id","Yes","INTEGER","A foreign key to a record in the [COHORT_DEFINITION](https://github.com/OHDSI/CommonDataModel/wiki/COHORT_DEFINITION) table containing relevant Cohort Definition information.","cohort_attribute"
"226","subject_id","Yes","INTEGER","A foreign key to the subject in the Cohort. These could be referring to records in the PERSON, PROVIDER, VISIT_OCCURRENCE table.","cohort_attribute"
"227","cohort_start_date","Yes","DATE","The date when the Cohort Definition criteria for the Person, Provider or Visit first match.","cohort_attribute"
"228","cohort_end_date","Yes","DATE","The date when the Cohort Definition criteria for the Person, Provider or Visit no longer match or the Cohort membership was terminated.","cohort_attribute"
"229","attribute_definition_id","Yes","INTEGER","A foreign key to a record in the [ATTRIBUTE_DEFINITION](https://github.com/OHDSI/CommonDataModel/wiki/ATTRIBUTE_DEFINITION) table containing relevant Attribute Definition information.","cohort_attribute"
"230","value_as_number","No","FLOAT","The attribute result stored as a number. This is applicable to attributes where the result is expressed as a numeric value.","cohort_attribute"
"231","value_as_concept_id","No","INTEGER","The attribute result stored as a Concept ID. This is applicable to attributes where the result is expressed as a categorical value.","cohort_attribute"
"232","condition_era_id","Yes","INTEGER","A unique identifier for each Condition Era.","condition_era"
"233","person_id","Yes","INTEGER","A foreign key identifier to the Person who is experiencing the Condition during the Condition Era. The demographic details of that Person are stored in the PERSON table.","condition_era"
"234","condition_concept_id","Yes","INTEGER","A foreign key that refers to a standard Condition Concept identifier in the Standardized Vocabularies.","condition_era"
"235","condition_era_start_date","Yes","DATE","The start date for the Condition Era constructed from the individual instances of Condition Occurrences. It is the start date of the very first chronologically recorded instance of the condition.","condition_era"
"236","condition_era_end_date","Yes","DATE","The end date for the Condition Era constructed from the individual instances of Condition Occurrences. It is the end date of the final continuously recorded instance of the Condition.","condition_era"
"237","condition_occurrence_count","No","INTEGER","The number of individual Condition Occurrences used to construct the condition era.","condition_era"
"238","dose_era_id","Yes","INTEGER","A unique identifier for each Dose Era.","dose_era"
"239","person_id","Yes","INTEGER","A foreign key identifier to the Person who is subjected to the drug during the drug era. The demographic details of that Person are stored in the PERSON table.","dose_era"
"240","drug_concept_id","Yes","INTEGER","A foreign key that refers to a Standard Concept identifier in the Standardized Vocabularies for the active Ingredient Concept.","dose_era"
"241","unit_concept_id","Yes","INTEGER","A foreign key that refers to a Standard Concept identifier in the Standardized Vocabularies for the unit concept.","dose_era"
"242","dose_value","Yes","FLOAT","The numeric value of the dose.","dose_era"
"243","dose_era_start_date","Yes","DATE","The start date for the drug era constructed from the individual instances of drug exposures. It is the start date of the very first chronologically recorded instance of utilization of a drug.","dose_era"
"244","dose_era_end_date","Yes","DATE","The end date for the drug era constructed from the individual instance of drug exposures. It is the end date of the final continuously recorded instance of utilization of a drug.","dose_era"
"245","drug_era_id","Yes","INTEGER","A unique identifier for each Drug Era.","drug_era"
"246","person_id","Yes","INTEGER","A foreign key identifier to the Person who is subjected to the Drug during the fDrug Era. The demographic details of that Person are stored in the PERSON table.","drug_era"
"247","drug_concept_id","Yes","INTEGER","A foreign key that refers to a Standard Concept identifier in the Standardized Vocabularies for the Ingredient Concept.","drug_era"
"248","drug_era_start_date","Yes","DATE","The start date for the Drug Era constructed from the individual instances of Drug Exposures. It is the start date of the very first chronologically recorded instance of conutilization of a Drug.","drug_era"
"249","drug_era_end_date","Yes","DATE","The end date for the drug era constructed from the individual instance of drug exposures. It is the end date of the final continuously recorded instance of utilization of a drug.","drug_era"
"250","drug_exposure_count","No","INTEGER","The number of individual Drug Exposure occurrences used to construct the Drug Era.","drug_era"
"251","gap_days","No","INTEGER","The number of days that are not covered by DRUG_EXPOSURE records that were used to make up the era record.","drug_era"
"252","cost_id","Yes","INTEGER","A unique identifier for each COST record.","cost"
"253","cost_event_id","Yes","INTEGER","A foreign key identifier to the event (e.g. Measurement, Procedure, Visit, Drug Exposure, etc) record for which cost data are recorded.","cost"
"254","cost_domain_id","Yes","VARCHAR(20)","The concept representing the domain of the cost event, from which the corresponding table can be inferred that contains the entity for which cost information is recorded.","cost"
"255","cost_type_concept_id","Yes","INTEGER","A foreign key identifier to a concept in the CONCEPT table for the provenance or the source of the COST data: Calculated from insurance claim information, provider revenue, calculated from cost-to-charge ratio, reported from accounting database, etc.","cost"
"256","currency_concept_id","No","INTEGER","A foreign key identifier to the concept representing the 3-letter code used to delineate international currencies, such as USD for US Dollar.","cost"
"257","total_charge","No","FLOAT","The total amount charged by some provider of goods or services (e.g. hospital, physician pharmacy, dme provider) to payers (insurance companies, the patient).","cost"
"258","total_cost","No","FLOAT","The cost incurred by the provider of goods or services.","cost"
"259","total_paid","No","FLOAT","The total amount actually paid from all payers for goods or services of the provider.","cost"
"260","paid_by_payer","No","FLOAT","The amount paid by the Payer for the goods or services.","cost"
"261","paid_by_patient","No","FLOAT","The total amount paid by the Person as a share of the expenses.","cost"
"262","paid_patient_copay","No","FLOAT","The amount paid by the Person as a fixed contribution to the expenses.","cost"
"263","paid_patient_coinsurance","No","FLOAT","The amount paid by the Person as a joint assumption of risk. Typically, this is a percentage of the expenses defined by the Payer Plan after the Person's deductible is exceeded.","cost"
"264","paid_patient_deductible","No","FLOAT","The amount paid by the Person that is counted toward the deductible defined by the Payer Plan. paid_patient_deductible does contribute to the paid_by_patient variable.","cost"
"265","paid_by_primary","No","FLOAT","The amount paid by a primary Payer through the coordination of benefits.","cost"
"266","paid_ingredient_cost","No","FLOAT","The amount paid by the Payer to a pharmacy for the drug, excluding the amount paid for dispensing the drug.  paid_ingredient_cost contributes to the paid_by_payer field if this field is populated with a nonzero value.","cost"
"267","paid_dispensing_fee","No","FLOAT","The amount paid by the Payer to a pharmacy for dispensing a drug, excluding the amount paid for the drug ingredient. paid_dispensing_fee contributes to the paid_by_payer field if this field is populated with a nonzero value.","cost"
"268","payer_plan_period_id","No","INTEGER","A foreign key to the PAYER_PLAN_PERIOD table, where the details of the Payer, Plan and Family are stored.  Record the payer_plan_id that relates to the payer who contributed to the paid_by_payer field.","cost"
"269","amount_allowed","No","FLOAT","The contracted amount agreed between the payer and provider.","cost"
"270","revenue_code_concept_id","No","INTEGER","A foreign key referring to a Standard Concept ID in the Standardized Vocabularies for Revenue codes.","cost"
"271","revenue_code_source_value","No","VARCHAR(50)","The source code for the Revenue code as it appears in the source data, stored here for reference.","cost"
"272","drg_concept_id","No","INTEGER","A foreign key to the predefined concept in the DRG Vocabulary reflecting the DRG for a visit.","cost"
"273","drg_source_value","No","VARCHAR(3)","The 3-digit DRG source code as it appears in the source data.","cost"
"274","payer_plan_period_id","Yes","INTEGER","A identifier for each unique combination of payer, sponsor, plan, family code and time span.","payer_plan_period"
"275","person_id","Yes","INTEGER","A foreign key identifier to the Person covered by the payer. The demographic details of that Person are stored in the PERSON table.","payer_plan_period"
"276","payer_plan_period_start_date","Yes","DATE","The start date of the payer plan period.","payer_plan_period"
"277","payer_plan_period_end_date","Yes","DATE","The end date of the payer plan period.","payer_plan_period"
"278","payer_concept_id","No","INTEGER","A foreign key that refers to a Standard Payer concept identifiers in the Standardized Vocabularies","payer_plan_period"
"279","payer_source_value","No","VARCHAR(50)","The source code for the payer as it appears in the source data.","payer_plan_period"
"280","payer_source_concept_id","No","INTEGER","A foreign key to a payer concept that refers to the code used in the source.","payer_plan_period"
"281","plan_concept_id","No","INTEGER","A foreign key that refers to a Standard plan that represents the health benefit plan in the Standardized Vocabularies","payer_plan_period"
"282","plan_source_value","No","VARCHAR(50)","The source code for the Person's health benefit plan as it appears in the source data.","payer_plan_period"
"283","plan_source_concept_id","No","INTEGER","A foreign key to a plan concept that refers to the code used in the source.","payer_plan_period"
"284","sponsor_concept_id","No","INTEGER","A foreign key that refers to a Standard plan that represents the sponsor in the Standardized Vocabularies","payer_plan_period"
"285","sponsor_source_value","No","VARCHAR(50)","The source code for the Person's sponsor of the health plan as it appears in the source data.","payer_plan_period"
"286","sponsor_source_concept_id*","No","INTEGER","A foreign key to a sponsor concept that refers to the code used in the source.","payer_plan_period"
"287","family_source_value","No","VARCHAR(50)","The source code for the Person's family as it appears in the source data.","payer_plan_period"
"288","stop_reason_concept_id","No","INTEGER","A foreign key that refers to a Standard termination reason that represents the reason for the termination in the Standardized Vocabularies.","payer_plan_period"
"289","stop_reason_source_value","No","VARCHAR(50)","The reason for stop-coverage of the record.","payer_plan_period"
"290","stop_reason_source_concept_id","No","INTEGER","A foreign key to a stop-coverage concept that refers to the code used in the source.","payer_plan_period"
"291","care_site_id","Yes","INTEGER","A unique identifier for each Care Site.","care_site"
"292","care_site_name","No","VARCHAR(255)","The verbatim description or name of the Care Site as in data source","care_site"
"293","place_of_service_concept_id","No","INTEGER","A foreign key that refers to a Place of Service Concept ID in the Standardized Vocabularies.","care_site"
"294","location_id","No","INTEGER","A foreign key to the geographic Location in the LOCATION table, where the detailed address information is stored.","care_site"
"295","care_site_source_value","No","VARCHAR(50)","The identifier for the Care Site in the source data, stored here for reference.","care_site"
"296","place_of_service_source_value","No","VARCHAR(50)","The source code for the Place of Service as it appears in the source data, stored here for reference.","care_site"
"297","location_id","Yes","INTEGER","A unique identifier for each geographic location.","location"
"298","address_1","No","VARCHAR(50)","The address field 1, typically used for the street address, as it appears in the source data.","location"
"299","address_2","No","VARCHAR(50)","The address field 2, typically used for additional detail such as buildings, suites, floors, as it appears in the source data.","location"
"300","city","No","VARCHAR(50)","The city field as it appears in the source data.","location"
"301","state","No","VARCHAR(2)","The state field as it appears in the source data.","location"
"302","zip","No","VARCHAR(9)","The zip or postal code.","location"
"303","county","No","VARCHAR(20)","The county.","location"
"304","location_source_value","No","VARCHAR(50)","The verbatim information that is used to uniquely identify the location as it appears in the source data.","location"
"305","provider_id","Yes","INTEGER","A unique identifier for each Provider.","provider"
"306","provider_name","No","VARCHAR(255)","A description of the Provider.","provider"
"307","npi","No","VARCHAR(20)","The National Provider Identifier (NPI) of the provider.","provider"
"308","dea","No","VARCHAR(20)","The Drug Enforcement Administration (DEA) number of the provider.","provider"
"309","specialty_concept_id","No","INTEGER","A foreign key to a Standard Specialty Concept ID in the Standardized Vocabularies.","provider"
"310","care_site_id","No","INTEGER","A foreign key to the main Care Site where the provider is practicing.","provider"
"311","year_of_birth","No","INTEGER","The year of birth of the Provider.","provider"
"312","gender_concept_id","No","INTEGER","The gender of the Provider.","provider"
"313","provider_source_value","No","VARCHAR(50)","The identifier used for the Provider in the source data, stored here for reference.","provider"
"314","specialty_source_value","No","VARCHAR(50)","The source code for the Provider specialty as it appears in the source data, stored here for reference.","provider"
"315","specialty_source_concept_id","No","INTEGER","A foreign key to a Concept that refers to the code used in the source.","provider"
"316","gender_source_value","No","VARCHAR(50)","The gender code for the Provider as it appears in the source data, stored here for reference.","provider"
"317","gender_source_concept_id","No","INTEGER","A foreign key to a Concept that refers to the code used in the source.","provider"
